{
  "schemaVersion": "ruleoak.governance.v1",
  "recordType": "EvidenceRecord",
  "evidenceId": "conformance-evidence-001",
  "runId": "conformance-run-001",
  "action": "read.source_document",
  "subject": "policy://access-control-baseline",
  "subjectType": "document",
  "source": "fixture",
  "metadata": {
    "sensitivity": "internal",
    "citationRequired": true
  },
  "createdAt": "2026-01-01T00:00:00.000Z",
  "hash": "3320fdc03d19f20cda11b7c8881ed01f6d60d534f9b42482aee04cb233416adc"
}
